{
  "assets": [],
  "content": "approved-internal-pilot-provisional",
  "font": "Inter-system-fallback-no-file",
  "format": "nexonova.generation-selection.v1",
  "omitted_paths": [
    ".github/prompts/vista-hablar-con-ventas.prompt.md",
    ".gitignore",
    ".vercelignore",
    ".vscode/settings.json",
    "AGENTS.md",
    "IMG_1290.HEIC",
    "LEEME.md",
    "README.md",
    "app/api/chat/route.ts",
    "app/api/domains/check/route.ts",
    "design/CHATBOT.md",
    "design/propuestas/calidad-v2/LEEME.md",
    "design/propuestas/calidad-v2/dominio-v2.png",
    "design/propuestas/calidad-v2/propiedad-v2.png",
    "design/propuestas/calidad-v2/responsive-v2.png",
    "lib/domains/nic-cl.ts",
    "lib/domains/types.ts",
    "lib/domains/verisign-com.ts",
    "middleware.ts",
    "next-env.d.ts",
    "next.config.ts",
    "package-lock.json",
    "package.json",
    "public/assets/IMG_1290.jpg",
    "public/assets/bandera-chile.jpg",
    "public/assets/brand/icon-domain-v2.png",
    "public/assets/brand/icon-domain.jpg",
    "public/assets/brand/icon-ownership-v2.png",
    "public/assets/brand/icon-ownership.jpg",
    "public/assets/brand/icon-responsive-v2.png",
    "public/assets/brand/icon-responsive.jpg",
    "public/assets/brand/icon-speed.jpg",
    "public/assets/brand/icon.png",
    "public/assets/brand/logo-footer-subtitle.png",
    "public/assets/brand/logo-footer.png",
    "public/assets/brand/logo-header.jpeg",
    "public/assets/brand/logo-hero-subtitle.png",
    "public/assets/brand/logo-url.png",
    "public/assets/brand/process-icons-set.jpg",
    "public/assets/brand/quality-icons-set.jpg",
    "public/assets/brand/social.jpeg",
    "public/assets/chile-map.png",
    "public/assets/chile-map.svg",
    "public/assets/contact-specialist-v1.png",
    "public/assets/datacenter-corp.jpg",
    "public/assets/gsap-3.15.0.min.js",
    "public/assets/hero-afro-entrepreneur-v1.png",
    "public/assets/hero-barrio-pyme-oleo-v2.png",
    "public/assets/hero-cities/coquimbo-1920.webp",
    "public/assets/hero-cities/coquimbo-3840.webp",
    "public/assets/hero-cities/coquimbo.jpg",
    "public/assets/hero-cities/creditos.html",
    "public/assets/hero-cities/los-angeles-1920.webp",
    "public/assets/hero-cities/los-angeles-3840.webp",
    "public/assets/hero-cities/los-angeles.jpg",
    "public/assets/hero-cities/temuco-1920.webp",
    "public/assets/hero-cities/temuco-3840.webp",
    "public/assets/hero-cities/temuco.jpg",
    "public/assets/hero-devices-desktop-poster-v1.jpg",
    "public/assets/hero-devices-mobile-poster-v1.jpg",
    "public/assets/hero-entrada-pyme-v3.png",
    "public/assets/hero-mockup-macbook-poster-v1.jpg",
    "public/assets/hero-mockup-mobile-poster-v1.jpg",
    "public/assets/hero-office-pyme-v1.png",
    "public/assets/hero-pyme-ssl-v1.png",
    "public/assets/hero-pymes-nexonova-v4.png",
    "public/assets/illust-domain-search.jpg",
    "public/assets/illust-growth-support.jpg",
    "public/assets/illust-pyme-store.jpg",
    "public/assets/loader-macbook-front-v1.png",
    "public/assets/loader-macbook-open-v1.png",
    "public/assets/loader-phone-angle-v1.png",
    "public/assets/loader-phone-front-v1.png",
    "public/assets/nexonova-sales.jpg",
    "public/assets/payments/mercado-pago.svg",
    "public/assets/payments/transbank.svg",
    "public/assets/payments/webpay.svg",
    "public/assets/promo-cocker.jpg",
    "public/assets/rocket-editorial-v3.png",
    "public/bento-services.css",
    "public/bento-services.js",
    "public/chat.css",
    "public/chat.js",
    "public/contact-banner.css",
    "public/desarrollo-web.html",
    "public/index.html",
    "public/landing-shop.js",
    "public/landing.config.js",
    "public/landing.css",
    "public/landing.js",
    "public/lib/storefront.js",
    "public/pricing-agentcard.css",
    "public/scroll-animations.js",
    "public/service-values.css",
    "public/site-connect.js",
    "public/ventas.html",
    "public/web-development.css",
    "tests/build.test.mjs",
    "tests/chat.test.mjs",
    "tests/domains.test.mjs",
    "tests/hero.test.mjs",
    "tests/quality.test.mjs",
    "tsconfig.json",
    "vercel.json"
  ],
  "resolved_for_scope": [
    "Approve final editorial content; commercial values remain provisional.",
    "Approve local Inter distribution and license evidence.",
    "Decide recover/replace/remove for missing referenced resources.",
    "Select exact logo/hero/icon assets and substantiate provenance; no shared assets approved by inference."
  ],
  "source_mode": "reference-only-no-copy",
  "source_tree_hash": "sha256:23a023c684d919d0c33ce6af34401136673ba32afd89a435c775db054cfe222c"
}
